,TI,AB,DI,PY,crowd,experts,aggregation,all,notes
1,Aggregating Probability Distributions,"This chapter is concerned with the aggregation of probability distributions in decision and risk analysis. Experts often provide valuable information regarding important uncertainties in decision and risk analyses because of the limited availability of hard data to use in those analyses. Multiple experts are often consulted in order to obtain as much information as possible, leading to the problem of how to combine or aggregate their information. Information may also be obtained from other sources such as forecasting techniques or scientific models. Because uncertainties are typically represented in terms of probability distributions, we consider expert and other information in terms of probability distributions. We discuss a variety of models that lead to specific combination methods. The output of these methods is a combined probability distribution, which can be viewed as representing a summary of the current state of information regarding the uncertainty of interest. After presenting the models and methods, we discuss empirical evidence on the performance of the methods. In the conclusion, we highlight important conceptual and practical issues to be considered when designing a combination process for use in practice.",10.1017/CBO9780511611308.010,2007,Y,Y,Y,TRUE,this one looks highly relevant!
6,Median Aggregation of Distribution Functions,"When multiple redundant probabilistic judgments are obtained from subject matter experts, it is common practice to aggregate their differing views into a single probability or distribution. Although many methods have been proposed for mathematical aggregation, no single procedure has gained universal acceptance. The most widely used procedure is simple arithmetic averaging, which has both desirable and undesirable properties. Here we propose an alternative for aggregating distribution functions that is based on the median cumulative probabilities at fixed values of the variable. It is shown that aggregating cumulative probabilities by medians is equivalent, under certain conditions, to aggregating quantiles. Moreover, the median aggregate has better calibration than mean aggregation of probabilities when the experts are independent and well calibrated and produces sharper aggregate distributions for well-calibrated and independent experts when they report a common location-scale distribution. We also compare median aggregation to mean aggregation of quantiles.",10.1287/deca.2013.0282,2013,Y,Y,Y,TRUE,highly relevant!
9,Crowd Wisdom Relies on Agents' Ability in Small Groups with a Voting Aggregation Rule,"In the last decade, interest in the ""wisdom of crowds"" effect has gained momentum in both organizational research and corporate practice. Crowd wisdom relies on the aggregation of independent judgments. The accuracy of a group's aggregate prediction rises with the number, ability, and diversity of its members. We investigate these variables' relative importance for collective prediction using agent-based simulation. We replicate the ""diversity trumps ability"" proposition for large groups, showing that samples of heterogeneous agents outperform same-sized homogeneous teams of high ability. In groups smaller than approximately 16 members, however, the effects of group composition depend on the social decision function employed: diversity is key only in continuous estimation tasks (averaging) and much less important in discrete choice tasks (voting), in which agents' individual abilities remain crucial. Thus, strategies to improve collective decision making must adapt to the predictive situation at hand.",10.1287/mnsc.2015.2364,2017,Y,N,Y,FALSE,
11,Combination and Selection of Traffic Safety Expert Judgments for the Prevention of Driving Risks,"In this paper, we describe a new framework to combine experts' judgments for the prevention of driving risks in a cabin truck. In addition, the methodology shows how to choose among the experts the one whose predictions fit best the environmental conditions. The methodology is applied over data sets obtained from a high immersive cabin truck simulator in natural driving conditions. A nonparametric model, based in Nearest Neighbors combined with Restricted Least Squared methods is developed. Three experts were asked to evaluate the driving risk using a Visual Analog Scale (VAS), in order to measure the driving risk in a truck simulator where the vehicle dynamics factors were stored. Numerical results show that the methodology is suitable for embedding in real time systems.",10.3390/s121114711,2012,Y,Y,Y,TRUE,
12,A Demand Forecasting Methodology for Fuzzy Environments,"Several supply chain and production planning models in the literature assume the demands are fuzzy but most of them do not offer a specific technique to derive the fuzzy demands. In this study, we propose a methodology to obtain a fuzzy-demand forecast that is represented by a possibilistic distribution. The fuzzy-demand forecast is found by aggregating forecasts based on different sources; namely statistical forecasting methods and experts' judgments. In the methodology, initially, the forecast derived from the statistical forecasting techniques and experts' judgments are represented by triangular possibilistic distributions. Subsequently, those results are combined by using weights assigned to each of them. A new objective weighting approach is used to find the weights. The proposed methodology is illustrated by an example and a sensitivity analysis is provided.",0,2010,Y,Y,Y,TRUE,
13,Recommending Outfits from Personal Closet,"We consider grading a fashion outfit for recommendation, where we assume that users have a closet of items and we aim at producing a score for an arbitrary combination of items in the closet. The challenge in outfit grading is that the input to the system is a bag of item pictures that are unordered and vary in size. We build a deep neural network-based system that can take variable-length items and predict a score. We collect a large number of outfits from a popular fashion sharing website, Polyvore, and evaluate the performance of our grading system. We compare our model with a random-choice baseline, both on the traditional classification evaluation and on people's judgment using a crowdsourcing platform. With over 84% in classification accuracy and 91% matching ratio to human annotators, our model can reliably grade the quality of an outfit. We also build an outfit recommender on top of our grader to demonstrate the practical application of our model for a personal closet assistant.",10.1109/WACV.2018.00036,2018,Y,N,Y,FALSE,
14,Deriving the probability of a linear opinion pooling method being superior to a set of alternatives,"Linear opinion pools are a common method for combining a set of distinct opinions into a single succinct opinion, often to be used in a decision making task. In this paper we consider a method, termed the Plug-in approach, for determining the weights to be assigned in this linear pool, in a manner that can be deemed as rational in some sense, while incorporating multiple forms of learning over time into its process. The environment that we consider is one in which every source in the pool is herself a decision maker (DM), in contrast to the more common setting in which expert judgments are amalgamated for use by a single DM. We discuss a simulation study that was conducted to show the merits of our technique, and demonstrate how theoretical probabilistic arguments can be used to exactly quantify the probability of this technique being superior (in terms of a probability density metric) to a set of alternatives. Illustrations are given of simulated proportions converging to these true probabilities in a range of commonly used distributional cases.",10.1016/j.ress.2016.10.008,2017,Y,Y,Y,TRUE,
15,Uncertainty and Expert Assessment for Supporting Evaluation of Levees Safety,"In France, levees remain most of the time badly maintained; these long linear structures show signs of weaknesses on numerous occasions. Only incomplete information is usually available. The general lack of data describing the behavior of the infrastructure during unwanted events led to estimate their safety mainly from expert judgment. Thus the ability of the expert to predict the level of functioning of an infrastructure for a type of hazard and its intensity is crucial. An error of judgment can have very serious consequences and the production of reliable information requires the ability of the expert to report accurately the uncertainties in its estimations, as well as associated confidence. In order to meet this need, our research within Incertu project (French Ministry of Ecology funding) aims to produce relevant scientific approaches and tools for the collection and processing reliable experts' statements or combined with a confidence level in the context of uncertain information and input data.",10.1051/e3sconf/20160703019,2016,Y,Y,Y,TRUE,